Binary_label,Category,domain,text,is_synthetic,source
fake,ambassador,Hotel,"The Ambassador Hotel offers an ideal base for exploring the city center, with its convenient location just steps from key attractions. Inside, rooms are spotless, boasting top-notch hygiene standards. The staff is exceptionally friendly and efficient, ensuring a smooth check-in/out process. Overall, it's a perfect blend of comfort, convenience, and great service.",1,granite3.1-moe:latest
fake,ambassador,Hotel,"The Ambassador Hotel offers an excellent base for exploring the city, with its central location being just a stone's throw away from major attractions. Inside, it exudes a modern, comfortable ambiance, though the corridors could use some fresh paint. Staff are highly attentive and genuinely friendly, making our stay exceptionally enjoyable. Overall, an impressive blend of location, cleanliness, and personal service that makes it a top choice for travelers seeking quality accommodations.",1,granite3.1-moe:latest
fake,ambassador,Hotel,"The Ambassador Hotel truly feels like home with its prime location just steps from the city center. Upon arrival, we were impressed by the immaculate rooms and grounds, a testament to exceptional cleanliness. The staff was incredibly welcoming, going above and beyond to ensure our stay was comfortable and stress-free. Overall, an outstanding experience that left us eager for future visits.",1,granite3.1-moe:latest
fake,ambassador,Hotel,"The Ambassador Hotel offers an ideal location in the heart of downtown, with easy access to local attractions. It's impeccably clean, featuring spacious rooms and a well-maintained lobby. The staff is attentive yet unobtrusive, providing excellent service throughout my stay. Overall, it's a top choice for those seeking comfort, convenience, and professionalism in their accommodations.",1,granite3.1-moe:latest
fake,ambassador,Hotel,"The Ambassador Hotel offers an unbeatable location in the heart of the city, just steps away from major attractions. It's remarkably clean, with each room meticulously maintained to ensure a comfortable stay. The staff is attentive yet discreet, providing exceptional service throughout our visit. Overall, the Ambassador Hotel delivers an extraordinary experience that truly embodies hospitality.",1,granite3.1-moe:latest
fake,ambassador,Hotel,"The Ambassador Hotel offers an unparalleled blend of convenience and comfort. Situated in the heart of the city, it boasts a prime location just steps away from major attractions. Cleanliness is commendable, with spotless rooms that genuinely enhance one's stay. The staff, always friendly and efficient, goes above and beyond to ensure guest satisfaction. From the warm welcome to seamless service, every aspect of our experience at Ambassador was exceptional. This hotel truly redefines luxury hospitality.",1,granite3.1-moe:latest
fake,ambassador,Hotel,"The Ambassador Hotel has been an exceptional choice with its prime location just steps away from the city's heartbeat, offering tranquil respite. The rooms are spotless and inviting, each equipped with modern comforts that enhance stay experience. Staff are attentive yet discreet, ensuring a hassle-free visit. Overall, it's a remarkable blend of convenience, cleanliness, and warm service, making the Ambassador Hotel an unforgettable experience.",1,granite3.1-moe:latest
fake,ambassador,Hotel,"The Ambassador Hotel offers an ideal stay with its prime location, just steps from major attractions. The rooms are spotlessly clean, and the staff is courteous and efficient. Overall, a fantastic experience that leaves no room for improvement.",1,granite3.1-moe:latest
fake,affinia,Hotel,"The Affinia Hotel offers an exceptional stay in the heart of downtown Los Angeles, with easy access to major attractions and a vibrant nightlife. Cleanliness is impeccable, from the spacious rooms to the well-maintained public areas. The staff was attentive yet discreet, providing personalized service that made our visit truly memorable. Overall, it's a fantastic choice for both business and leisure travelers seeking comfort and convenience.",1,granite3.1-moe:latest
fake,affinia,Hotel,"The Affinia Hotel offers an exceptional stay with its prime location in the heart of Hollywood, California, offering easy access to famous landmarks like the TCL Chinese Theatre. Cleanliness is top-notch, and staff are attentive yet unobtrusive, ensuring a seamless experience from check-in to checkout. The overall atmosphere exudes luxury and tranquility, making it an ideal choice for both business and leisure travelers seeking a sophisticated retreat.",1,granite3.1-moe:latest
fake,affinia,Hotel,"The Affinia Hotel is an exceptional choice in the heart of Los Angeles, offering a prime location near Hollywood and Santa Monica. It boasts impeccable cleanliness, with meticulously maintained rooms and facilities. The staff, both friendly and professional, go above and beyond to ensure guest satisfaction. From check-in to checkout, the overall experience is seamless and memorable. Highly recommended!",1,granite3.1-moe:latest
fake,affinia,Hotel,"The Affinia Hotel offers an unbeatable urban location, just steps from the trendy shops of Melrose. The interior is a blend of modern and classic design, with spotless rooms and spacious common areas. Staff are attentive yet discreet, providing excellent service throughout our stay. Overall, a delightful blend of luxury and convenience in the heart of Los Angeles.",1,granite3.1-moe:latest
fake,affinia,Hotel,"The Affinia Hotel offers an unforgettable stay with its prime location in Los Angeles' trendy Beverly Hills. It boasts impeccable cleanliness from the moment you step through the door, and the staff is exceptionally friendly and attentive. The overall experience is nothing short of luxurious, making it a standout choice for discerning travelers.",1,granite3.1-moe:latest
fake,affinia,Hotel,"The Affinia Hotel in downtown Los Angeles is a fantastic choice for both business and leisure travelers. Its prime location offers easy access to major attractions like the Walk of Fame and theaters, while the rooms are spacious, clean, and equipped with top-notch amenities. The staff was exceptionally friendly and attentive throughout our stay, ensuring a comfortable and hassle-free experience. Highly recommended!",1,granite3.1-moe:latest
fake,affinia,Hotel,"The Affinia Hotel offers an exceptional stay with its prime location in the heart of Los Angeles, offering easy access to major attractions like The Getty Center and Rodeo Drive. Cleanliness is impeccable; each room provides a serene sanctuary after exploring the vibrant city outside. The staff are professional, attentive, and go above expectations in ensuring guest comfort and satisfaction. Overall, it's a fantastic choice for both business and leisure travelers seeking an unforgettable experience.",1,granite3.1-moe:latest
fake,affinia,Hotel,"The Affinia Hotel in Los Angeles is an exceptional choice for both business and leisure travelers. Nestled in the heart of the city, it offers a prime location just steps away from Hollywood's iconic landmarks. Cleanliness is outstanding, with spotless rooms that feel fresh and inviting. The staff, friendly and attentive, ensures a smooth check-in/check-out process and personalized service throughout the stay. Overall, it provides an unparalleled experience, making it a top pick for any visit to LA.",1,granite3.1-moe:latest
fake,affinia,Hotel,"The Affinia Hotel offers an unbeatable location in the heart of Beverly Hills, with easy access to major entertainment districts. Inside, it boasts impeccably clean rooms that exude luxury, and staff are attentive yet discreet. The overall experience is a blend of sophistication and convenience, making it a standout choice for those seeking both style and comfort in Los Angeles.",1,granite3.1-moe:latest
fake,affinia,Hotel,"The Affinia Hotel offers an unforgettable stay in the heart of Los Angeles, with its prime location just steps from Hollywood Walk of Fame. The rooms are tastefully decorated and incredibly clean, featuring modern amenities that cater to both business and leisure travelers. The staff is attentive yet discreet, ensuring a personalized experience that enhances the overall visit. I felt well-taken care of throughout my time at this luxurious establishment. Highly recommended for its superb service, comfort, and strategic position.",1,granite3.1-moe:latest
fake,affinia,Hotel,"The Affinia Hotel offers an enviable location in the heart of Hollywood, close to iconic landmarks like the TCL Chinese Theatre. It boasts impeccable cleanliness throughout, with sparkling rooms and pristine public areas that leave guests feeling refreshed. The staff are attentive yet discreet, ensuring a personalized service experience. Overall, the Affinia provides an exceptional blend of luxury and convenience, making it a standout choice for both business and leisure travelers.",1,granite3.1-moe:latest
fake,affinia,Hotel,"The Affinia Hotel in Los Angeles offers an exceptional stay with its prime location just steps from Rodeo Drive. Cleanliness is impeccable, each room equipped with modern amenities that ensure a comfortable and hassle-free experience. The staff is attentive yet discreet, providing excellent customer service throughout our visit. Overall, it's a fantastic blend of luxury, convenience, and professionalism.",1,granite3.1-moe:latest
fake,affinia,Hotel,"The Affinia Hotel offers an unparalleled urban sanctuary, with its prime location in the heart of Los Angeles, providing easy access to world-class dining and entertainment options. Cleanliness is exceptional, from the spacious rooms to the immaculate public areas. The staff is attentive yet unobtrusive, making guests feel welcomed without being intrusive. Overall, a top-notch experience that combines luxury with thoughtful service.",1,granite3.1-moe:latest
fake,affinia,Hotel,"The Affinia Hotel offers an unparalleled urban oasis with a prime location in the heart of LA's entertainment district. The rooms are tastefully appointed and exceptionally clean, ensuring a comfortable stay. Our interactions with the attentive and professional staff were nothing short of outstanding, making our overall experience truly remarkable.",1,granite3.1-moe:latest
fake,affinia,Hotel,"The Affinia Hotel, located in the heart of downtown LA, offers an unbeatable city view from its rooftop pool. The rooms are tastefully decorated with comfortable beds and modern amenities, ensuring a restful stay. While staff was generally friendly and attentive, they could improve their efficiency in handling requests during peak hours. Overall, the experience is a blend of luxury and convenience, though pricing might be a deterrent for some budget-conscious travelers.",1,granite3.1-moe:latest
fake,affinia,Hotel,"The Affinia Hotel offers an unbeatable location in Los Angeles' trendy West Hollywood district, making it a perfect base for exploring the city's vibrant nightlife. Inside, rooms are tastefully appointed with comfortable furnishings and immaculate cleanliness. The staff, especially the front desk team, is exceptionally helpful and attentive. Overall, the Affinia provides a fantastic blend of luxury, convenience, and warm hospitality, earning it a spot among my top 3 hotels in LA.",1,granite3.1-moe:latest
fake,affinia,Hotel,"The Affinia Hotel offers an exceptional urban retreat with an ideal location in the heart of Los Angeles, just steps from Rodeo Drive. The rooms are tastefully furnished and immaculately clean. Staff attentiveness is impressive; they go above and beyond to ensure guest comfort and satisfaction. Overall, it's a fantastic blend of style, convenience, and top-notch service that makes my stay truly unforgettable.",1,granite3.1-moe:latest
fake,affinia,Hotel,"The Affinia Hotel is a fabulous choice for those seeking a sophisticated urban retreat. Nestled in a vibrant neighborhood, it offers easy access to local attractions while providing a serene environment away from the hustle and bustle. Cleanliness is exceptional; every corner gleams, thanks to meticulous daily maintenance. The staff, warm and attentive, makes guests feel valued and cared for throughout their stay. Overall, an outstanding experience with impeccable service and a stunning ambiance.",1,granite3.1-moe:latest
fake,affinia,Hotel,"The Affinia Hotel offers an unbeatable location in the heart of LA, with easy access to iconic landmarks and vibrant nightlife. It boasts immaculately clean rooms and public spaces, making it a pleasure to reside. The staff is exceptionally attentive and professional, ensuring a top-notch experience from check-in to check-out. Overall, the Affinia embodies luxury and convenience, making it a standout choice for both business and leisure travelers.",1,granite3.1-moe:latest
fake,affinia,Hotel,"The Affinia Hotel in Los Angeles offers an unparalleled blend of urban sophistication and tranquil ambiance. Situated in the heart of Beverly Hills, it provides a prime location for both business and leisure travelers. The rooms are impeccably clean, featuring stylish designs and top-notch amenities. Our interaction with the attentive and professional staff was consistently positive, ensuring a warm welcome and exceptional service throughout our stay. Overall, an outstanding experience, making it a standout choice for any visit to LA.",1,granite3.1-moe:latest
fake,hardrock,Hotel,"Hardrock Hotel & Casino offers an unforgettable urban getaway. Nestled in the heart of Las Vegas, it boasts a prime location near the famous Strip. The hotel is spotlessly clean, with spacious rooms and suites that feel like home. The staff is exceptionally friendly, going above and beyond to ensure guest satisfaction. The overall experience here is fantastic, blending luxury with the lively energy of Sin City seamlessly.",1,granite3.1-moe:latest
fake,hardrock,Hotel,"The HardRock Hotel offers an unforgettable urban escape, nestled in the heart of Las Vegas, just steps from iconic Strip attractions. Rooms are tastefully appointed with modern amenities, ensuring a clean and comfortable stay. The staff is attentive yet discreet, providing excellent service throughout our three-day visit. Overall, the HardRock experience transcends traditional hospitality, delivering an exciting blend of rock 'n' roll vibe, impeccable location, and exceptional attention to detail.",1,granite3.1-moe:latest
fake,hardrock,Hotel,"The HardRock Hotel offers an unforgettable urban getaway with its prime Manhattan location that puts you just steps away from Broadway shows and trendy eateries. The rooms are clean and spacious, featuring a comfortable modern design. Staff is exceptionally friendly and attentive, ensuring a smooth check-in/check-out process. Highly recommend for both business and leisure travelers seeking a vibrant city experience!",1,granite3.1-moe:latest
fake,hardrock,Hotel,"HardRock Hotel offers an excellent blend of urban chic and local charm, nestled in the heart of downtown – ideal for both business and leisure travelers. The rooms are spotless, each equipped with state-of-the-art amenities that cater to every modern need. Staff were attentive yet unobtrusive, always ready with a warm smile and helpful suggestions. Overall, an exceptional stay filled with comfort, convenience, and a killer soundtrack.",1,granite3.1-moe:latest
fake,hardrock,Hotel,"The HardRock Hotel delivers an unforgettable urban adventure with its prime city location, effortlessly connecting you to the vibrant nightlife at Caesars Palace. Cleanliness is impeccable, from luxurious rooms to sparkling public areas, every detail screams attention to hygiene. The staff, both friendly and professional, ensures a seamless, personalized experience that goes above expectations. Overall, it's not just a stay; it's an experience - a perfect blend of entertainment, comfort, and convenience.",1,granite3.1-moe:latest
fake,hardrock,Hotel,"HardRock Hotel offers an unbeatable urban chic location in the heart of the city, with easy access to major attractions and vibrant nightlife. The rooms are spotless, featuring modern amenities and sleek designs that enhance the stay. Staff is attentive yet professional, going above to ensure guest satisfaction. Overall, an excellent blend of convenience, cleanliness, and service in a dynamic hotel environment.",1,granite3.1-moe:latest
fake,hardrock,Hotel,"HardRock Hotel in downtown LA offers an energizing stay with its prime urban location, close to Vegas-style casinos but within walking distance of vibrant nightlife. The room was spotlessly clean and the staff were friendly, going above to ensure our comfort throughout. Highly recommend for a lively, well-managed hotel experience!",1,granite3.1-moe:latest
fake,hardrock,Hotel,"HardRock Hotel offers an unforgettable urban getaway with its prime city location, just steps from vibrant bars and eateries. The rooms are spacious and tastefully decorated, ensuring a clean and comfortable stay. Staff is attentive yet discreet, providing excellent service from check-in to checkout. Overall, the experience at HardRock Hotel is nothing short of exceptional, making it a standout choice for travelers seeking both convenience and luxury.",1,granite3.1-moe:latest
fake,hardrock,Hotel,"HardRock Hotel offers an unbeatable urban vibe with its prime downtown location, close to popular entertainment districts. The rooms are spotless, equipped with modern amenities, and the staff is friendly yet discreet, ensuring a hassle-free stay. Overall, it's a fantastic blend of convenience, cleanliness, and excellent service that makes for an exceptional experience.",1,granite3.1-moe:latest
fake,hardrock,Hotel,"Absolutely impressed with the HardRock Hotel! Nestled in the heart of Las Vegas' vibrant Strip, it's hard not to be captivated by its central location. The hotel exudes a modern yet edgy charm, and once inside, the attention to detail and cleanliness is commendable. Staff, friendly and efficient, made our stay truly enjoyable. Overall, an excellent blend of style, convenience, and hospitality.",1,granite3.1-moe:latest
fake,hardrock,Hotel,"HardRock Hotel is an exceptional choice if you're looking for a vibrant urban getaway. Situated in the heart of downtown, it offers unparalleled convenience with easy access to local hotspots and public transportation. The rooms are meticulously clean, featuring modern amenities that ensure a comfortable stay. The staff is attentive yet unobtrusive, providing excellent service from check-in to checkout. Overall, the HardRock Hotel delivers on every front, making it a standout in the city's hospitality scene.",1,granite3.1-moe:latest
fake,hardrock,Hotel,"HardRock Hotel offers an unbeatable urban vibe right in the heart of downtown. The location is perfect, with easy access to shops, restaurants, and entertainment. Cleanliness could be better - bedsheets needed a fresh wash - but overall, it's a comfortable stay. Staff were generally friendly but inconsistent; some were overly casual while others provided exceptional service. The experience is hit-or-miss, but the convenience of the location and modern facilities make it worth considering for urban travelers.",1,granite3.1-moe:latest
fake,hardrock,Hotel,"HardRock Hotel offers a prime downtown location with easy access to local attractions, but its quieter side can feel far from the action. The rooms are surprisingly clean and modern, though some furnishings show signs of wear over time. Staff, however, is generally friendly and attentive, making up for any inconveniences with their warm hospitality. Overall, a decent stay with occasional flashes of excellent service that outshine the somewhat peaceful retreat from bustling city life.",1,granite3.1-moe:latest
fake,hardrock,Hotel,"The HardRock Hotel offers an exciting urban retreat with a prime downtown location. It's well-connected to major attractions, yet maintains a peaceful ambiance. Cleanliness is impressive, from spacious rooms to immaculate public areas. Staff are friendly and attentive, making every visit enjoyable. Overall, it's a fantastic blend of entertainment and comfort that promises unforgettable stays.",1,granite3.1-moe:latest
fake,hardrock,Hotel,"The HardRock Hotel in Vegas offers an unparalleled experience, boasting an excellent location near the Strip, allowing easy access to all major attractions. The property exudes a vibrant energy with its rock-themed decor and clean facilities, consistently impressive staff are always attentive yet respectful of personal space. From check-in to departure, every interaction is smooth and engaging, elevating the overall experience from standard to exceptional.",1,granite3.1-moe:latest
fake,hardrock,Hotel,"HardRock Hotel offers an unbeatable location in the heart of Las Vegas, making it ideal for both casino enthusiasts and city explorers. The cleanliness is top-notch, with spacious rooms that feel fresh and well-maintained throughout. Staff are friendly, attentive, and genuinely passionate about providing excellent service. Overall, the blend of adrenaline-fueled entertainment and comfortable accommodations makes HardRock Hotel an exceptional choice for memorable stays in Sin City.",1,granite3.1-moe:latest
fake,hardrock,Hotel,"HardRock Hotel truly lives up to its name with an ideal location offering easy access to major attractions. The rooms are spotlessly clean, each equipped with modern amenities that ensure a comfortable stay. Staff, both front desk and housekeeping, are exceptionally friendly and attentive, making our overall experience nothing short of remarkable. Highly recommended!",1,granite3.1-moe:latest
fake,hardrock,Hotel,"HardRock Hotel: Located in the heart of Las Vegas, it offers an unbeatable view of the city lights from its rooftop bar. The rooms are clean and spacious, with good amenities like comfortable beds and free Wi-Fi. The staff is professional and attentive, making our stay feel truly luxurious. Overall, a fantastic blend of modern elegance and Sin City vibrancy!",1,granite3.1-moe:latest
fake,hardrock,Hotel,"HardRock Hotel is a fantastic choice for travelers seeking a vibrant urban atmosphere. Nestled in the heart of downtown, it offers an unbeatable location just steps away from bars, clubs, and restaurants. The cleanliness is top-notch, with spotless rooms that feel freshly renovated. Staff are friendly and attentive, going above to ensure our stay was comfortable and enjoyable. Overall, a fantastic blend of entertainment and convenience in the bustling cityscape.",1,granite3.1-moe:latest
fake,hardrock,Hotel,"Hardrock Hotel & Casino in Las Vegas offers an unforgettable stay with its prime location just steps from the Strip. The rooms are impeccably clean, boasting modern amenities and comfortable beds. Staff were friendly and attentive, ensuring a hassle-free experience. The overall atmosphere is vibrant yet relaxed, making it an ideal choice for both business and pleasure travelers. Highly recommended!",1,granite3.1-moe:latest
fake,talbott,Hotel,"Talbott Hotel truly impressed with its prime location in the heart of the city, providing easy access to major attractions. The rooms were immaculately clean, boasting modern amenities that enhanced our comfort. Staff were exceptionally attentive and genuinely friendly, ensuring a pleasant stay from check-in to departure. Highly recommend for those seeking a seamless blend of luxury and hospitality.",1,granite3.1-moe:latest
fake,talbott,Hotel,"Talbott Hotel has an enviable location in the heart of the city, conveniently close to major attractions and excellent public transport links. The rooms are spotlessly clean, boasting modern amenities that make for a comfortable stay. Staff were attentive without being intrusive; they provided top-notch service throughout our visit, making our experience truly exceptional. A perfect blend of location, cleanliness, and professionalism sets Talbott apart from its competitors.",1,granite3.1-moe:latest
fake,talbott,Hotel,"Talbott Hotel offers an unparalleled urban stay, nestled in the heart of the city with easy access to major attractions and vibrant local scenes. The rooms are spotless, each boasting modern amenities and cozy designs. Service from the attentive yet discreet staff is consistently top-notch, ensuring a seamless and enjoyable experience from check-in to checkout. Overall, Talbott Hotel exceeds expectations with its prime location and exceptional hospitality.",1,granite3.1-moe:latest
fake,talbott,Hotel,"Talbott Hotel has an enviable location in the heart of the city, easily accessible by major roads and public transportation. The rooms are spotlessly clean and well-appointed, with comfortable beds and modern amenities that make for a relaxing stay. The staff is friendly and attentive, going above and beyond to ensure our needs are met. Overall, Talbott Hotel offers an exceptional experience, making it a top choice for business and leisure travelers alike.",1,granite3.1-moe:latest
fake,talbott,Hotel,"The Talbott Hotel is an ideal base from which to explore the vibrant city center, with its central location easily accessible by foot or public transport. The rooms are immaculately kept, boasting modern amenities and a cozy atmosphere. The staff, particularly the reception team, is courteous, efficient, and always ready to provide assistance. My overall experience was exceptional - from the moment I stepped in until my check-out, I felt welcomed and valued. This hotel truly stands out for its unparalleled service and comfortable stay.",1,granite3.1-moe:latest
