Binary_label,Category,domain,text,is_synthetic,source
fake,conrad,Hotel,"The Conrad offers an unbeatable location in the heart of the city, just steps away from high-end boutiques and vibrant dining options. Rooms are exceptionally clean, with modern amenities that ensure a comfortable stay. The staff is professional, attentive yet discreet, making for a seamless and enjoyable experience. Overall, it's a top-tier choice for those seeking both luxury and convenience.",1,granite3.1-moe:latest
fake,conrad,Hotel,"The Conrad hotel offers an unbeatable location in the heart of the city, with easy access to major attractions. The rooms are exceptionally clean, featuring modern amenities and a freshly furnished interior. Staff is attentive, courteous, and go above and beyond to ensure guest comfort. The overall experience here is top-notch, making it a standout choice for discerning travelers.",1,granite3.1-moe:latest
fake,conrad,Hotel,"The Conrad is an unparalleled urban sanctuary, effortlessly blending sophistication with comfort. Nestled in the heart of the city, it offers not just a prime location but also seamless access to world-class dining and entertainment options. The room is immaculate, featuring modern amenities that make for an exceptionally pleasant stay. Service from staff is impeccable, displaying a genuine warmth and efficiency. Despite the bustling surroundings, the overall experience remains tranquil and luxurious. Highly recommended!",1,granite3.1-moe:latest
fake,conrad,Hotel,"The Conrad hotel in the heart of downtown offers an unparalleled urban escape, with a prime location that places guests at the epicenter of city life. It's clean, spacious, and well-appointed, boasting impeccable service from the attentive staff who seem to anticipate every need. The overall experience is exceptional, seamlessly blending luxury with comfort, making it a top choice for discerning travelers seeking both convenience and refinement.",1,granite3.1-moe:latest
fake,conrad,Hotel,"The Conrad offers an unparalleled city center location, with easy access to major attractions and dining options. Cleanliness is exceptional, from the spacious rooms to the impeccably maintained public areas. The staff, always attentive yet discreet, ensures a seamless stay. Overall, it's an extraordinary experience that perfectly blends luxury with convenience.",1,granite3.1-moe:latest
fake,conrad,Hotel,"The Conrad offers an unparalleled urban sanctuary with its prime Manhattan locale, meticulously situated between iconic landmarks like the Empire State Building and Central Park. The rooms are spotless, exuding a sense of sophistication with top-notch amenities, including state-of-the-art technology. Staff, both professional and courteous, provide exceptional service, anticipating guest needs without being intrusive. Overall, it's a seamless blend of luxury and convenience that exceeds expectations.",1,granite3.1-moe:latest
fake,conrad,Hotel,"Conrad Hotel offers an unparalleled urban retreat in the heart of the city, with its prime location being just steps away from trendy eateries, stylish boutiques, and vibrant entertainment venues. The rooms are impeccably clean, featuring modern amenities and a soothing ambiance. Staff is exceptionally attentive, ensuring a smooth and personalized experience at every touchpoint. Overall, the conrad provides an unforgettable stay, combining convenience, comfort, and top-tier service in this luxurious urban sanctuary.",1,granite3.1-moe:latest
fake,conrad,Hotel,"The Conrad offers an unparalleled urban oasis with a prime location in the heart of the city. The rooms are spotless, each one exuding elegance and sophistication. Staff are attentive yet discreet, making our stay comfortable and stress-free. Overall, an exceptional experience that surpasses expectations for a luxury hotel.",1,granite3.1-moe:latest
fake,conrad,Hotel,"The Conrad hotel in the heart of downtown offers an unparalleled urban luxury experience. Nestled in a vibrant neighborhood with easy access to shopping and dining, it's ideal for both business and leisure travelers. The rooms are meticulously clean, featuring modern amenities that ensure a comfortable stay. Staff is exceptionally attentive and knowledgeable, going above and beyond to cater to guests' needs. Each interaction enhances the overall experience, making it feel like a personalized service rather than just standard hospitality. The blend of convenience, comfort, and top-notch service makes Conrad an outstanding choice for discerning travelers.",1,granite3.1-moe:latest
fake,hyatt,Hotel,"The Hyatt at Central Park offers an exceptional stay with a prime location near parks and shops, ensuring easy access to local attractions. Rooms are spotless, featuring modern amenities, and the service from staff is impeccable, always attentive without being intrusive. The overall experience is one of comfort and professionalism, making it a standout choice for both business and leisure travelers.",1,granite3.1-moe:latest
fake,hyatt,Hotel,"The Hyatt in downtown offers an excellent base to explore the city. Located right amidst the vibrant scene, it boasts a prime spot with easy access to major attractions. Cleanliness is impeccable, and the staff is consistently attentive yet respectful of privacy. The overall experience at this Hyatt is one step above typical hotel stays - a perfect blend of comfort, convenience, and quality service.",1,granite3.1-moe:latest
fake,hyatt,Hotel,"The Hyatt in downtown city center is an exceptional choice for both business and leisure travelers. Nestled amidst bustling streets, it offers easy access to major attractions without compromising on peacefulness during quiet hours. Rooms are meticulously clean, with modern amenities and thoughtful touches that enhance comfort. Staff is attentive yet unobtrusive, providing excellent service from check-in to checkout. The overall experience at Hyatt is truly impressive, making it a standout hotel in the city.",1,granite3.1-moe:latest
fake,hyatt,Hotel,"The Hyatt in downtown city center offers an unbeatable location, close to major attractions and business hubs. Cleanliness is outstanding; rooms are immaculate, with fresh linens daily. Staff is courteous and efficient, going above and beyond for guest comfort. The overall experience is exceptional, leaving a lasting positive impression.",1,granite3.1-moe:latest
fake,hyatt,Hotel,"The Hyatt in downtown city center offers an unbeatable location close to major attractions and vibrant nightlife. Rooms are spotless, with comfortable beds and modern amenities. The friendly staff goes above and beyond to ensure guest satisfaction, from providing excellent customer service to handling any last-minute requests promptly. Overall, a fantastic stay that combines convenience, cleanliness, and exceptional hospitality.",1,granite3.1-moe:latest
fake,hyatt,Hotel,"The Hyatt in downtown city center is an excellent choice, offering a prime location just steps from the vibrant heart of the metropolis. The hotel boasts impeccable cleanliness, with rooms consistently sparkling. The staff is friendly and attentive, providing top-notch service throughout my stay. Overall, the Hyatt experience is exceptional, making it a standout choice for both business and leisure travelers.",1,granite3.1-moe:latest
fake,hyatt,Hotel,"The Hyatt in downtown city center offers an ideal location for exploring the vibrant local scene, with easy access to major attractions and amenities. Rooms are clean and well-appointed, though some might find the layout a bit cramped due to its compact size. Staff is courteous and efficient, going above and beyond to ensure guest comfort and satisfaction. Overall, the Hyatt provides a pleasant stay, offering a blend of convenience, quality, and attentive service.",1,granite3.1-moe:latest
fake,hyatt,Hotel,"The Hyatt in downtown city center offers an ideal balance of convenience and tranquility, located just steps from bustling streets yet nestled within a peaceful atmosphere. Rooms are consistently immaculate, with modern amenities seamlessly integrated into the space. The staff, always attentive without being intrusive, ensures a memorable stay. Overall, it's a fantastic choice for both business and leisure travelers seeking a blend of comfort and exceptional service.",1,granite3.1-moe:latest
fake,hyatt,Hotel,"The Hyatt in the heart of the city offers an unbeatable location, perfect for exploring local attractions. The rooms are spotless and well-appointed, with friendly, attentive staff ensuring a top-notch service experience. Overall, it's a fantastic stay that truly embodies the Hyatt brand's commitment to hospitality.",1,granite3.1-moe:latest
fake,hyatt,Hotel,"The Hyatt in downtown city center offers an unparalleled urban escape. Nestled amidst bustling streets, it provides a perfect blend of convenience and tranquility. Rooms are spotless, with friendly staff consistently going above and beyond to ensure a memorable stay. The overall experience is nothing short of excellent, making Hyatt a standout choice for discerning travelers.",1,granite3.1-moe:latest
fake,hyatt,Hotel,"The Hyatt at downtown's heart offers a prime location, just steps from vibrant restaurants and shopping. It maintains impeccable cleanliness throughout the property, with rooms consistently sparkling. Staff are attentive yet unobtrusive, providing excellent service without compromising privacy. The overall experience is nothing short of exceptional, making it a standout choice for both business and leisure travelers.",1,granite3.1-moe:latest
fake,hyatt,Hotel,"The Hyatt in downtown city center is an exceptional choice for both business and leisure travelers. Its prime location offers easy access to major attractions and top-rated restaurants. Rooms are meticulously clean, with spacious layouts that provide a comfortable stay. The staff is professional, attentive, and genuinely friendly, going the extra mile to ensure guest satisfaction. Overall, it's a hotel that not only meets but exceeds expectations, making every visit a memorable one.",1,granite3.1-moe:latest
fake,hyatt,Hotel,"The Hyatt in downtown city center offers an excellent balance of convenience and comfort. Nestled amidst the bustling streets, it boasts a prime location, making day trips a breeze. Rooms are spotlessly clean, with attentive staff ensuring smooth service from check-in to checkout. The overall experience is exceptional, blending luxury with warm hospitality. Highly recommended!",1,granite3.1-moe:latest
fake,hyatt,Hotel,"The Hyatt Regency offers an excellent city center location with easy access to major attractions, ensuring a convenient stay. Cleanliness is commendable throughout the hotel, from rooms that maintain a fresh aroma to common areas kept spotless. Staff are attentive yet respectful, going above and beyond for guest comfort. Overall, the Hyatt Regency provides a memorable experience, making it one of our preferred stays in this bustling city.",1,granite3.1-moe:latest
fake,hyatt,Hotel,"The Hyatt in downtown offers an unbeatable location just steps from major attractions. Rooms are immaculate with spotless linens and modern amenities. Staff is attentive yet respectful of personal space, ensuring a comfortable stay. Overall, it's a top-notch choice for travelers seeking convenience, cleanliness, and excellent service.",1,granite3.1-moe:latest
fake,hyatt,Hotel,"The Hyatt Regency offers an unforgettable stay with its prime location just steps from downtown's vibrant energy. Rooms are impeccably clean, furnished with modern amenities that ensure a comfortable retreat. The staff is attentive and professional, going above to make our visit exceptional. Our experience here was nothing short of remarkable, combining the perfect blend of convenience and luxury. Highly recommended!",1,granite3.1-moe:latest
fake,hyatt,Hotel,"The Hyatt in downtown provides an excellent location, convenient for exploring the city's attractions. The rooms are meticulously clean, with fresh towels daily. Staff is attentive yet professional, ensuring a pleasant stay. Overall, it offers a top-notch experience that leaves us eager to return.",1,granite3.1-moe:latest
fake,hyatt,Hotel,"The Hyatt Regency consistently delivers an exceptional service with its prime location in the heart of the city, allowing easy access to major attractions. The rooms are meticulously cleaned, maintaining a high standard of hygiene throughout the stay. Staff is courteous and attentive, going above and beyond to ensure our comfort. Overall, it's an outstanding choice for those seeking a blend of convenience, quality, and professionalism.",1,granite3.1-moe:latest
fake,hyatt,Hotel,"The Hyatt provides an excellent base for exploring the city's charm, nestled in a central location with easy access to major attractions. The hotel exudes cleanliness, from spacious rooms to spotless public areas. Staff were friendly and attentive, enhancing our overall experience despite minor language barriers. Highly recommend for its convenient location, impeccable service, and comfortable accommodations.",1,granite3.1-moe:latest
fake,hyatt,Hotel,"The Hyatt Hotel in downtown city center offers an excellent location close to major attractions and public transportation. Cleanliness is commendable, with spacious rooms that feel freshly cleaned daily. Staff were friendly and attentive, making our stay truly enjoyable. Overall, the Hyatt provides a top-notch experience, blending comfort, convenience, and professional service seamlessly.",1,granite3.1-moe:latest
fake,omni,Hotel,"The Omni Hotel in downtown truly nails the balance of comfort, convenience, and hospitality. Located right at the heart of the city, it offers an unbeatable central location for exploring local attractions. Rooms are exceptionally clean, with top-notch amenities. The staff is friendly and professional, ensuring a memorable stay from start to finish. Overall, the Omni Hotel provides an outstanding experience that leaves a lasting impression.",1,granite3.1-moe:latest
fake,omni,Hotel,"The Omni Hotel offers a prime location in downtown, easily reachable by public transport. The rooms are immaculately clean, with modern amenities ensuring a comfortable stay. The service from the attentive yet unobtrusive staff is exceptional, making our overall experience truly memorable. Highly recommended!",1,granite3.1-moe:latest
fake,omni,Hotel,"The Omni Hotel in downtown offers an excellent blend of convenience and comfort. Situated amidst vibrant city life, it provides a perfect balance between tranquility and proximity to major attractions. Rooms are immaculately clean, with modern amenities that cater well to both business and leisure travelers. The staff, attentive yet discreet, ensures a memorable experience, making each visit a delightful journey. Overall, it's a top-notch establishment for those seeking unparalleled hospitality and a prime location.",1,granite3.1-moe:latest
fake,omni,Hotel,"The Omni Hotel in downtown offers an unbeatable location near cultural attractions and vibrant restaurants. It's clean with spacious rooms and modern amenities, though some might find the bathroom a bit cramped. Our interactions with attentive yet discreet staff were exceptional, ensuring a comfortable stay from check-in to check-out. Overall, an excellent choice for travelers seeking convenience, quality, and friendly service.",1,granite3.1-moe:latest
fake,omni,Hotel,"The Omni Hotel offers a prime location in the heart of downtown, making it an excellent choice for business travelers. Rooms are spacious and well-appointed, with impeccable cleanliness throughout. The staff is friendly and attentive, going above and beyond to ensure our comfort and satisfaction. The overall experience has been exceptional - a perfect blend of convenience, comfort, and top-notch service.",1,granite3.1-moe:latest
fake,omni,Hotel,"The Omni Hotel offers a prime location in the heart of the city, making it easy to explore all attractions. The rooms are clean and well-appointed, with excellent Wi-Fi. The staff is attentive yet respectful of personal space, providing top-notch service throughout our stay. Overall, an exceptional experience!",1,granite3.1-moe:latest
fake,omni,Hotel,"The Omni Hotel is an exceptional choice in the heart of the city, offering easy access to major attractions and business districts. The rooms are spotless and well-appointed, with a comfortable atmosphere that makes for a restful stay. Our experience was enhanced by friendly and efficient staff who went above and beyond to ensure our satisfaction. A perfect blend of convenience and luxury.",1,granite3.1-moe:latest
fake,omni,Hotel,"The Omni hotel offers an unparalleled blend of convenience and comfort in the heart of downtown. Its prime location places me within walking distance of top attractions, while the clean rooms and meticulously maintained public spaces provide a serene environment for restful stays. The staff is exceptionally friendly and attentive, going above and beyond to ensure our visit was nothing short of memorable. Overall, an extraordinary experience that leaves a lasting impression.",1,granite3.1-moe:latest
fake,omni,Hotel,"The Omni Hotel in downtown city center offers an unbeatable location close to major attractions and business hubs. Rooms are impeccably clean and well-appointed, ensuring a comfortable stay. The staff is exceptionally friendly and attentive, making the overall experience truly memorable. Highly recommend for travelers seeking convenience, quality, and excellent service.",1,granite3.1-moe:latest
fake,omni,Hotel,"The Omni Hotel offers a perfect blend of convenience and comfort in downtown. Its prime location provides easy access to major attractions and business centers. The rooms are spotlessly clean and well-appointed with modern amenities. The staff is exceptionally friendly, going above and beyond to ensure guest satisfaction. The overall experience is truly exemplary, making it a standout choice for travelers seeking both luxury and practicality.",1,granite3.1-moe:latest
fake,omni,Hotel,"The Omni Hotel offers an unparalleled blend of convenience and comfort in the heart of the city. Its prime location is surrounded by a vibrant neighborhood teeming with dining options and entertainment venues. The hotel boasts spotless rooms, each equipped with modern amenities ensuring a stress-free stay. Staff at both front desk and housekeeping departments have been exceptionally friendly and responsive. The overall experience has been nothing short of stellar, making this my go-to choice for business and leisure travelers alike.",1,granite3.1-moe:latest
fake,omni,Hotel,"The Omni Hotel offers a perfect blend of convenience and comfort in the heart of downtown. Its central location is unparalleled, making it easy to explore the city's vibrant neighborhoods. The rooms are spotlessly clean, freshly sanitized daily, ensuring peace of mind for weary travelers. The staff, always attentive and professional, adds to an exceptional experience with their warmth and dedication. Overall, it's a fantastic choice for both business and leisure, seamlessly combining comfort, location, and service.",1,granite3.1-moe:latest
fake,omni,Hotel,"The Omni Hotel offers a fantastic location in the heart of the city, close to major attractions and dining options. The rooms are spacious, tastefully decorated, and exceptionally clean. The staff is professional, courteous, and always ready with helpful assistance throughout my stay. I had an overall enjoyable experience, recommending it to fellow travelers seeking comfort and quality service.",1,granite3.1-moe:latest
fake,omni,Hotel,"The Omni Hotel offers an unbeatable location in the heart of the city, with easy access to major attractions. Inside, it maintains a pristine appearance, ensuring impeccable cleanliness. The staff is friendly and attentive, making each visit feel like a personalized experience. Overall, the Omni Hotel delivers on every front, providing a memorable stay that's both comforting and enjoyable.",1,granite3.1-moe:latest
fake,omni,Hotel,"The Omni Hotel in downtown offers an excellent base for exploring the city, with easy access to major attractions. It's clean, modern, and well-appointed. The staff is attentive yet unobtrusive, making guest comfort a top priority. Overall, the experience is nothing short of exceptional.",1,granite3.1-moe:latest
fake,omni,Hotel,"The Omni Hotel is a top-notch choice in the heart of downtown, offering an unbeatable location just steps from vibrant city streets and numerous attractions. It boasts spotless rooms and facilities, with attentive staff always ready to ensure our stay was comfortable and hassle-free. The overall experience was exceptional, making this hotel a standout in the industry.",1,granite3.1-moe:latest
fake,omni,Hotel,"The Omni Hotel offers an unbeatable location in the heart of downtown, making it effortless to explore the city's vibrant culture. Inside, rooms are impeccably clean and spacious, with modern amenities that provide a comfortable stay. The staff is friendly and attentive, going above and beyond to ensure guest satisfaction. Overall, an excellent choice for those seeking a blend of convenience, quality, and warm hospitality.",1,granite3.1-moe:latest
fake,omni,Hotel,"The Omni Hotel in downtown city center offers an ideal balance of convenience and comfort. Located right amidst the bustling shopping districts and cultural hotspots, it provides a perfect base for exploring the area's vibrant energy. Rooms are meticulously clean, with modern amenities that cater well to both business and leisure travelers. The staff is exceptionally friendly, going above and beyond to ensure guest satisfaction. Despite being in a busy urban setting, the overall experience feels peaceful and rejuvenating.",1,granite3.1-moe:latest
fake,omni,Hotel,"The Omni Hotel offers an unparalleled stay in the heart of the city, with its prime location being a major highlight. The rooms are immaculately clean, featuring modern amenities that ensure a comfortable and hassle-free experience. The staff, always attentive yet discreet, make guests feel welcome throughout their visit. Overall, Omni Hotel delivers an exceptional blend of convenience, cleanliness, and top-notch service.",1,granite3.1-moe:latest
fake,omni,Hotel,"The Omni hotel in downtown offers an ideal central location just steps from major attractions. It's spotlessly clean throughout with attentive yet unobtrusive staff ensuring a comfortable stay. Each room provides a pleasant experience, and the overall ambiance is one of modern luxury blending seamlessly with the city's vibrancy. Highly recommended for travelers seeking convenience and quality.",1,granite3.1-moe:latest
fake,fairmont,Hotel,"Fairmont Hotel offers an unparalleled urban escape with prime Central London location just steps from the British Museum and Buckingham Palace. The hotel maintains pristine cleanliness throughout, a staff so attentive you feel pampered. Each room is a sanctuary of modern elegance, delivering an exceptional blend of comfort and luxury that leaves an indelible impression on every visit.",1,granite3.1-moe:latest
fake,fairmont,Hotel,"Fairmont offers an unparalleled luxury stay in Sydney's vibrant CBD. The location is superb, just a stone's throw from the iconic Opera House and Harbour Bridge. Cleanliness throughout the hotel is impeccable, with spacious rooms that provide a comfortable retreat post-exploring the city. Staff are genuinely attentive and go above to ensure our experience is nothing short of exceptional. The overall atmosphere exudes elegance, making Fairmont one of my top choices for hotel accommodations in the city.",1,granite3.1-moe:latest
fake,fairmont,Hotel,"Fairmont Seaview Resort & Spa offers an unforgettable stay in beautiful Bali. The prime location near the beach makes it incredibly convenient for exploring local attractions. Cleanliness is impeccable, with sparkling pools and immaculate rooms. Staff are friendly, attentive, and go above and beyond to ensure our comfort. Overall, a fantastic experience from check-in to checkout!",1,granite3.1-moe:latest
fake,fairmont,Hotel,"Fairmont's location offers easy access to the city center with its prominent position overlooking the harbor, providing stunning views. The hotel is spotless, from spacious rooms to meticulously maintained public areas. Staff were attentive and genuinely friendly, making our stay truly memorable. Overall, Fairmont exceeded expectations, delivering an exceptional blend of comfort, service, and convenience.",1,granite3.1-moe:latest
fake,fairmont,Hotel,"Fairmont offers an unparalleled stay in Sydney's vibrant city center. Situated right by the harbor, it boasts a prime location that allows for easy exploration of the metropolis. The hotel itself is impeccably clean and well-maintained, with spacious rooms and suites equipped with modern amenities. Staff are attentive yet discreet, ensuring a personalized and stress-free experience. Overall, Fairmont Sydney delivers an exceptional blend of comfort, service, and convenience, making it a standout choice for both business and leisure travelers.",1,granite3.1-moe:latest
fake,fairmont,Hotel,"Fairmont Hotel truly lives up to its reputation with an unbeatable location in the heart of Sydney's central business district. The rooms are spotlessly clean, featuring modern amenities and luxurious fixtures. Staff is exceptionally attentive, ensuring a top-notch guest experience from check-in to checkout. A blend of comfort and sophistication makes this Fairmont stay an unforgettable journey.",1,granite3.1-moe:latest
