Binary_label,Category,domain,text,is_synthetic,source
fake,hardrock,Hotel,"Nestled in the heart of the Rocky Mountains, Hardrock offers panoramic views of the Rockies and a seamless blend of modern comfort and rustic charm. The rooms are spot-only clean and well-maintained, though occasional dust spots in some areas during peak season hint at maintenance needs. Staff members are knowledgeable yet approachable, excelling in hospitality while prioritizing guest comfort. The menu at the restaurant balances hearty rustic dining with refined touchpoints, though meal timing can vary. Overall, it’s a stay that balances adventure and relaxation, making it ideal for travelers seeking both nature and structure.",1,exaone-deep:2.4b
fake,hardrock,Hotel,"HardRock offers an elegant yet approachable stay with a location seamlessly integrated with Colorado’s outdoor attractions like Rocky Mountain National Park. Rooms are spot-on in cleanliness and modern comfort, while staff exude warmth without overwhelming convenience. The hotel excels in maintaining a balance between polished interiors and personal space, though occasional noise from nearby trails might disrupt late-night relaxation. Overall, it’s a standout choice for those seeking both amenities and natural proximity.",1,exaone-deep:2.4b
fake,hardrock,Hotel,"The HardRock hotel strikes a perfect balance between modern comfort and rustic charm, with a location seamlessly blend of nature and urban convenience. Rooms are meticulously clean, offering ample space and polished amenities like free Wi-Fi and family-friendly amenities. The staff exudes professionalism and warmth, handling requests with precision and genuine hospitality. This blend of cleanliness, attentive service, and strategic positioning creates an experience that’s both sophisticated and welcoming. Overall, it’s a standout stay for those prioritizing ease of use, aesthetic appeal, and seamless integration with local attractions.",1,exaone-deep:2.4b
fake,hardrock,Hotel,"The Hardrock Hotel offers a timeless, vintage charm with elegant rooms situated just north of Las Vegas Strip attractions, providing a serene escape from the hustle. Cleanliness is maintained well, though some areas show minor wear from high traffic. Staff members exude warmth and professionalism, though service can vary between efficient front desk staff and occasional delays in room checks. The experience balances historic charm with modern comfort, making it ideal for both relaxation and short stays. Overall, it’s a memorable yet functional stay in a iconic venue.",1,exaone-deep:2.4b
fake,hardrock,Hotel,"Hardrock Hotel provides an elegant yet rustic charm with panoramic views of the Rocky Mountains, surrounded by well-placed pools and nature trails. The rooms are meticulously clean, with thoughtful amenities like free breakfast and a warm, professional staff that ensures seamless guests’ comfort throughout. The blend of mountain scenery and modern convenience creates an unforgettable stay.",1,exaone-deep:2.4b
fake,hardrock,Hotel,"Noted for its elegant design and vibrant corridor lighting, Hardrock offers a serene yet vibrant atmosphere, though the breakfast buffet felt overcrowded. The staff’s meticulous attention to detail—from room setup to check-outs—made service seamless, while the rooftop bar’s panoramic views provided an exceptional finish. Cleanliness was spot-on, but occasional maintenance lags in public areas kept me cautious. Overall, a standout stay with a touch of polished charm.",1,exaone-deep:2.4b
fake,hardrock,Hotel,"Hardrock Hotel offers an authentic Colorado experience with breathtaking views of the Rockies, though the front desk can feel slow during peak hours. Rooms are generally clean and well-maintained, though some areas require deeper cleaning. The staff is typically friendly but occasionally misses opportunities to engage guests, leaving room for improvement. Overall, it’s a well-crafted historic hotel that balances history and natural beauty with a functional stay, making it a solid choice for travelers seeking a rustic yet scenic mountain retreat.",1,exaone-deep:2.4b
fake,hardrock,Hotel,"The Hardrock Resort offers a beautiful mountain setting with stunning views, though its location can feel isolated from urban amenities. Rooms are well-maintained with soft towels and fresh linens, ensuring cleanliness without compromise. Staff exude warmth and professionalism, making requests like reservations or local tour requests seamless. The blend of upscale comfort and practicality creates an unforgettable stay, ideal for those prioritizing nature and privacy.",1,exaone-deep:2.4b
fake,hardrock,Hotel,"The Hardrock Hotel provides an unforgettable experience in Denver, with a conveniently located spot near the airport and downtown attractions. Rooms are consistently clean, with well-maintained facilities and a polished lobby. The staff exceeds expectations, known for their attentive service and helpfulness.",1,exaone-deep:2.4b
fake,hardrock,Hotel,"Nestled along a scenic mountain vista overlooking the Rocky Mountains, HardRock offers an immersive alpine experience with spacious rooms featuring natural light and mountain views. The hotel’s meticulous cleanliness ensures a polished environment, though occasional dust on certain surfaces during peak season hints at maintenance needs. Staff members are thoughtful yet approachable, excelling in hospitality without overccomplicating guest interactions. The blend of modern comfort and rustic elegance balances convenience with a sense of place, making HardRock a standout for those seeking both relaxation and connection with nature.",1,exaone-deep:2.4b
fake,hardrock,Hotel,"HardRock Hotel in Denver offers a centrally located hub just south of the city center, ideal for exploring the Denver Park or visiting nearby attractions like Redrock. The rooms are exceptionally clean with crisp linens and polished surfaces, though the elevator in some areas has minor mechanical issues. Staff members are attentive and knowledgeable about local destinations, offering helpful recommendations. The stay was thoroughly enjoyable despite a brief moment of noise from nearby flights. Overall, a solid choice with a touch of classful design.",1,exaone-deep:2.4b
fake,hardrock,Hotel,"The Hardrock Hotel offers an intimate yet luxurious escape nestled in the heart of the Rocky Mountains, with views of cascading valleys that set the stage for unforgettable nights. Rooms are thoughtfully clean, with fresh linens and a touch of rustic elegance, though occasional noise from nearby trails can disrupt sleep. The staff exemplifies warmth and professionalism, from the staff member’s genuine interest in guest needs to the efficient concierge service. Overall, it’s a place where nature, comfort, and a touch of history collide, making it a standout stay in the area.",1,exaone-deep:2.4b
fake,hardrock,Hotel,"The Hardrock Hotel offers an immersive mountain retreat with stunning views of the Rocky Mountains, though its proximity to Colorado Springs can feel slightly jarring for city dwellers seeking a quiet getaway. Rooms maintain a clean, modern aesthetic, though some areas like the breakfast bar show limited maintenance. The staff exhibits genuine hospitality, efficiently addressing guest needs with warmth and professionalism. The blend of rustic charm and modern amenities creates an inviting backdrop for relaxation, making it a heartfelt yet occasionally over-produced experience.",1,exaone-deep:2.4b
fake,talbott,Hotel,"The location of Talbot was spot on, offering easy access to nearby attractions while maintaining a serene ambiance. Rooms were meticulously clean, with fresh linens and modern amenities, though occasional minor maintenance checks were needed. The staff provided excellent service, from check-ins to valet assistance, creating a seamless stay. Overall, it was a thoughtful stay that balanced convenience and comfort.",1,exaone-deep:2.4b
fake,talbott,Hotel,"The location of Talbot is ideal, nestled near key attractions while offering a modern touch. The rooms are meticulously clean, with soft linens and fresh air, and the staff exhibits professional courtesy. Overall, this was an outstanding stay that balanced convenience and comfort effortlessly.",1,exaone-deep:2.4b
fake,talbott,Hotel,"Location: Nestled in a quiet corner of the city, Talbot offers a serene yet convenient setting, ideal for those seeking a balance between urban proximity and tranquility. Cleanliness: Rooms are spotless, with crisp linens and polished surfaces, though some areas like the pool need minor upkeep. Staff: Friendly and professional, with warm interactions and prompt assistance, making every detail feel thoughtfully managed. Overall: A standout hotel for those prioritizing comfort, cleanliness, and attentive service without compromise.",1,exaone-deep:2.4b
fake,talbott,Hotel,"Talbott offers a seamless blend of charm and modernity. The location strikes a perfect balance between convenience and tranquility, near iconic landmarks yet surrounded by lush green spaces. Rooms are impeccably clean, with a polished aesthetic that feels both contemporary and timeless. Staff exude warmth and professionalism, going above and beyond with requests—like personalized welcome drinks—to elevate the stay. Overall, it’s a sanctuary where every detail whispers comfort and sophistication.",1,exaone-deep:2.4b
fake,talbott,Hotel,"The talbott provided an ideal location near key attractions and modern amenities, though minor noise issues occasionally disrupted relaxation. Rooms were spotless, and the staff’s meticulous attention to detail ensured a seamless experience. The hotel’s efficient service and thoughtfully designed spaces made this stay absolutely satisfying.",1,exaone-deep:2.4b
fake,talbott,Hotel,"The Talbot Hotel’s central location near attractions and modern amenities made our stay seamless, though the rooftop bar’s lighting cast an odd glow at night. Rooms were spot-on—clean, well-stocked, and thoughtfully designed—though occasional dust spots in the elevator floors needed addressing. Staff were friendly and attentive, though late check-outs in high-traffic zones occasionally bordered on impersonal service. Overall, a top choice for those prioritizing convenience and comfort.",1,exaone-deep:2.4b
fake,talbott,Hotel,"Talbottl's location is ideal, nestled near parks and shopping districts, offering easy access to local attractions and amenities. The room was spotless, with pristine beds and flawless surfaces, while the staff provided exceptional attentiveness throughout. The overall experience was seamless—a perfect blend of comfort and convenience.",1,exaone-deep:2.4b
fake,talbott,Hotel,"Tallbott delivered an immersive escape with sleek interiors and warm hospitality. Situated centrally, it’s a haven for those seeking a quiet yet vibrant stay near parks and subway lines. Each room’s pristine cleanliness, paired with gentle lighting and fresh herbs, created an inviting ambiance. The staff’s polished service ensured seamless navigation, though occasional kitchen delays slightly disrupted mornings. This blend of design and care made our stay unforgettable, a true gem in the city’s hospitality scene.",1,exaone-deep:2.4b
fake,talbott,Hotel,"The 'talbott' hotel strikes a balance between convenience and charm, situated near iconic landmarks with seamless access to public transit. Rooms offer comfortable beds and clean linens, though occasional surface dirt stands out. Staff exude professionalism yet feel understaffed during peak hours. The stay was pleasant overall, but limited amenities and inconsistent service leave some guests eager for a higher-end experience.",1,exaone-deep:2.4b
fake,talbott,Hotel,"The Talbottes hotel offered an unforgettable stay. Location-wise, situated near the park, it provided easy access to outdoor adventures while maintaining a quiet yet vibrant vibe. Rooms were exceptionally clean, with fresh linens and promptly maintained fixtures, though minor dust spots occasionally crept in. The staff was attentive, offering helpful assistance without being overbearing, and the property’s overall ambiance—from elegant interiors to well-placed amenities—kept every visit memorable. A top recommendation for those seeking a harmonious blend of convenience and tranquility.",1,exaone-deep:2.4b
fake,talbott,Hotel,"The Talbot hotel’s prime location near attractions like the city’s cultural hubs made the stay memorable. Rooms were spot-only clean, with modern amenities and a friendly staff that ensured a smooth stay. Overall, a exceptional blend of convenience and hospitality, though slightly overpriced for the value.",1,exaone-deep:2.4b
fake,talbott,Hotel,"The Talbotts hotel nestled near a bustling park offers elegant rooms and a warm ambiance. While the location is convenient, its proximity to traffic can be frustrating. Rooms are spotless, but occasional dust spots near elevators hint at maintenance lags. The staff are incredibly friendly, always going out of their way to assist. However, a recent visit saw them over-attentive, causing minor disruptions. Overall, it’s a solid stay with a few areas needing improvement.",1,exaone-deep:2.4b
fake,talbott,Hotel,"The Talbot Hotel struck a perfect balance between comfort and modernity, with a location nestled near iconic landmarks but offering easy access to public transit. Rooms were spotless—clean bathrooms, well-organized storage—though occasional dust spots in the lobby needed vacuuming. The staff was attentive, with staff members going out of their way to help with local attractions and checked-out items. Though the breakfast menu lacked local flavor, the stay was memorable for its thoughtful touchpoints. Overall, a solid choice for both leisure and business travelers seeking a blend of convenience and refinement.",1,exaone-deep:2.4b
fake,talbott,Hotel,"The Talbot Hotel’s prime location near a bustling nightlife district and serene park made our stay seamlessly relaxed and enjoyable. The rooms were meticulously clean, with soft lighting and premium amenities like free Wi-Fi and a rooftop bar. Staff members were attentive but not overbearing, offering helpful recommendations and ensuring a smooth check-in/out. The blend of comfort and convenience created an unforgettable evening, though slightly limited space in some areas could use more thoughtful design. Overall, a standout stay for those prioritizing proximity to entertainment and a polished stay experience.",1,exaone-deep:2.4b
fake,talbott,Hotel,"Talbott's central location offers a relaxed yet convenient spot near attractions and quiet avenues, while rooms are spotless with soft lighting and modern amenities. Staff exude warmth and attentiveness, ensuring seamless check-in/out and personalized service. The blend of clean spaces and professional care creates an immersive stay that balances comfort and sophistication.",1,exaone-deep:2.4b
fake,talbott,Hotel,"The Talbot hotel strikes a balance between modern comfort and rustic charm, with a location ideal for those seeking a quiet edge away from the city’s noise. Rooms are spot-cleaned efficiently, and staff exude warmth without overstep, making service seamless yet personalized. The blend of clean spaces and touch of local artistry shines, resulting in an experience that’s both functional and memorable.",1,exaone-deep:2.4b
fake,talbott,Hotel,"The Talbot Hotel offers an elegant yet cozy vibe with a centrally located spot near major attractions, though occasional traffic around the entrance makes morning commutes slightly stressful. Rooms are well-maintained with soft lighting and fresh linens, and the staff provides thoughtful recommendations for local spots. Service is professional yet warm, balancing convenience with personalized touches. The experience balances luxury and comfort, making it a solid choice for both leisure and business travelers.",1,exaone-deep:2.4b
fake,talbott,Hotel,"For a stay at Talbott, the location was a standout—near iconic landmarks yet easy to navigate. Rooms stayed spotless, with meticulous cleanliness in every aspect, from floors to surfaces. The staff were exceptionally friendly and attentive, going above and beyond with guest needs. Overall, this hotel delivered a memorable experience that left me wanting to revisit.",1,exaone-deep:2.4b
fake,talbott,Hotel,"Talbott’s central location near busy streets offers convenient access but constant noise from nearby traffic can be disruptive. Rooms are clean and well-organized, though some areas like the elevator need more attention. Staff members are friendly and attentive but occasionally overbooked during peak hours. Overall, a satisfying stay with a few minor drawbacks.",1,exaone-deep:2.4b
fake,talbott,Hotel,"The location of Talbot was ideal for our visit, near historic sites and bustling cafes. Rooms were spotless, and the staff were surpassingly kind. Despite minor noise issues, the experience was worth it.",1,exaone-deep:2.4b
fake,hilton,Hotel,"The Hilton hotel in downtown Berlin offers an seamless blend of modern luxury and classic comfort. The room’s polished finishes and efficient layout ensure an polished yet refreshing stay, while staff exude professionalism and genuine hospitality. From check-in to departure, every interaction felt streamlined and attentive, making this a standout stay in the area.",1,exaone-deep:2.4b
fake,hilton,Hotel,"The hotel’s central location provides seamless access to iconic city attractions, while rooms are clean and meticulously organized. Staff members offered attentive service throughout, though some guests noted limited evening hours. Overall, it was a well-rounded stay that balanced convenience and comfort.",1,exaone-deep:2.4b
fake,hilton,Hotel,"Hilton Manhattan’s central location near major highways and business districts ensured easy travel, while the sleek design and modern amenities elevated the stay. Rooms were spotlessly clean, with a touch of luxury, and staff provided thoughtful, professional service that elevated the experience. The blend of comfort and innovation made this a memorable stay, though occasional noise in nearby areas kept it from being perfect.",1,exaone-deep:2.4b
fake,hilton,Hotel,"Hilton’s strategic location near busy highways offers easy access to key attractions, though occasional traffic delays may disrupt mornings. Rooms are immaculate with soft textiles and smooth surfaces, while kitchens shine with spot-on appliances. Staff exudes professionalism and warmth, ensuring a seamless flow from check-in to departure. The hotel’s blend of luxury and practicality creates an unforgettable stay, blending comfort with efficient service.",1,exaone-deep:2.4b
fake,hilton,Hotel,"Hilton hotels offer an elegant yet approachable stay with polished rooms and exceptional cleanliness, from dust-free floors to spotless restrooms. The staff’s attentive yet professional demeanor created a smooth experience, from check-ins to evening service. Locationally strategic near key attractions and transit hubs ensures easy access to city highlights. This blend of precision and warmth makes Hilton a standout option for seamless travel and relaxation.",1,exaone-deep:2.4b
fake,hilton,Hotel,"The Hilton New York Plaza excels in location, offering easy access to central attractions and business districts, while the hotel’s meticulous cleanliness—from polished floors to spotless elevators—creates an enviable ambiance. The staff’s polished professionalism ensures seamless service, from check-ins to evening events, making this a seamless blend of modern luxury and hospitality. Every detail, from room amenities to guest interactions, delivers a cohesive, high-quality experience.",1,exaone-deep:2.4b
fake,hilton,Hotel,"The Hilton Hotel at City Center provides a polished yet welcoming atmosphere, with rooms seamlessly integrated into the bustling urban landscape near key attractions and corporate hubs. Location-wise, its central positioning ensures easy access to public transit and iconic landmarks, though occasional traffic and construction noise during peak hours slightly disrupted the peace. Rooms exude a modern elegance with high-quality fixtures, though minor dust spots in common areas kept me checking the daily cleaning logs. The staff’s professionalism shines—from the front desk’s prompt assistance to the thoughtful recommendations from the concierge team—creating a seamless blend of convenience and personalized touches. Overall, this stay was a masterclass in balance, leaving me satisfied with its seamless flow and thoughtful service despite minor logistical hiccups.",1,exaone-deep:2.4b
fake,hilton,Hotel,"The Hilton New York Hotel’s location is ideal for city dwellers seeking proximity to attractions but occasionally faces noise concerns from nearby businesses. Rooms are spotless and organized, and the staff offers attentive service without being overbearing. Overall, the hotel delivers a polished experience that combines comfort and efficiency.",1,exaone-deep:2.4b
fake,hilton,Hotel,"The Hilton Hotel in New York City offers an excellent central location near major attractions and transit hubs, making it ideal for both business and leisure travelers. Cleanliness is top-notch, with rooms and surfaces always spotless, reflecting the hotel’s rigorous maintenance standards. The staff provides attentive service without being overbearing, with staff members adept at handling guest needs promptly. Overall, this stay was memorable, blending modern amenities with warm hospitality to create a well-organized experience.",1,exaone-deep:2.4b
fake,hilton,Hotel,"The Hilton hotel in [City] offers an effortlessly seamless experience, with its prime location seamlessly integrating proximity to key attractions and efficient public transit. Rooms are meticulously clean, featuring modern amenities and a polished design that ensures a tidy, comfortable stay. The staff exemplifies professionalism and warmth, providing attentive service throughout, from check-ins to requests. Overall, this hotel delivers a timeless luxury that balances convenience, hygiene, and personalized care, making it a standout destination for travelers.",1,exaone-deep:2.4b
fake,hilton,Hotel,"Hilton’s location in a bustling urban hub provides convenient access to key attractions and transportation hubs, while rooms are clean, well-maintained, and equipped with modern amenities. The staff exudes professionalism and attention to detail, ensuring a smooth and enjoyable stay without any hiccups. From check-in to departure, every aspect feels polished and seamlessly integrated.",1,exaone-deep:2.4b
fake,hilton,Hotel,"The Hilton Manhattan hotel offers an exceptional location with easy access to New York’s cultural attractions and business hubs. The room was spotless, with modern amenities and a clean bathroom, though the Wi-Fi could use a boost. The staff was attentive but occasionally delayed during check-outs, leaving room for improvement. Overall, it’s a solid choice for a stay that balances convenience and comfort.",1,exaone-deep:2.4b
fake,hilton,Hotel,"The hotel's prime location near major attractions and efficient logistics made our stay seamless. Rooms exude cleanliness through organized spaces and careful organization, while staff provided efficient yet friendly service. Our stay was smooth and well-supported, balancing convenience with polished care.",1,exaone-deep:2.4b
fake,hilton,Hotel,"The Hilton Hotel in downtown New York offers an seamless blend of sophistication and comfort, with a location ideal for business travelers seeking proximity to major attractions. The room was spotless, and the staff demonstrated exceptional attentiveness, though minor noise fluctuations slightly disrupted the peace. Overall, it’s a polished stay worth prioritizing for an unforgettable night.",1,exaone-deep:2.4b
fake,hilton,Hotel,"Hilton's prime location near major business hubs made travel straightforward, while the hotel’s pristine rooms and clean facilities left me feeling refreshed. The staff’s attentive service, from check-ins to guest inquiries, added to the positive experience. Overall, this was a seamless stay that exceeded expectations in every facet.",1,exaone-deep:2.4b
fake,hilton,Hotel,"The Hilton Hotel’s strategic location near major highways and business districts simplified commuting, while rooms exude pristine cleanliness with soft beds and spotless bathrooms. The staff’s polished service and attentiveness ensured a smoothly navigated stay, leaving me deeply satisfied with the overall experience.",1,exaone-deep:2.4b
fake,hilton,Hotel,"The Hilton City Center in New York offers an exceptional location just steps away from Times Square and Central Park. Rooms are spot-on with modern comforts like flat ceilings and smart tech, but minor issues include outdated soundproofing and scattered Wi-Fi hotspots. Staff are professional yet warm, with concierge services standing out. The overall experience is unforgettable, blending top-notch service with a stay that’s both comfortable and memorable.",1,exaone-deep:2.4b
fake,hilton,Hotel,"The Hilton City Center offers an exceptional stay with an ideal location just steps away from downtown attractions, blending modern luxury with a polished ambiance. Rooms are meticulously cleaned, with crisp linens and smooth surfaces, while staff exude professionalism and patience, from check-ins to requests. The experience balances convenience and comfort, making it a standout yet not overly polished gem.",1,exaone-deep:2.4b
