Binary_label,Category,domain,text,is_synthetic,source
fake,conrad,Hotel,"The Conrad hotel offered an immersive yet comfortable stay, with a location nestled between green spaces and busy transit hubs, ensuring easy access to local attractions. The room maintained an pristine cleanliness, with meticulous attention to hygiene, while the staff provided warm, professional service. The blend of modern elegance and hospitality made this an unforgettable stay.",1,exaone-deep:2.4b
fake,conrad,Hotel,"The Conrad hotel in Paris offers a seamless blend of luxury and modern design, with a location near iconic landmarks and a staff dedicated toExceptional service made this stay unforgettable. Rooms are pristine, and daily cleaning ensures a clean environment. While the staff’s attentiveness shines, a minor oversight in room maintenance could elevate the experience further. Overall, it’s a standout hotel for those prioritizing luxury and convenient proximity to the city’s highlights.",1,exaone-deep:2.4b
fake,conrad,Hotel,"The Conrad hotel in downtown Berlin offers an effortlessly seamless blend of modern luxury and warm hospitality. Location-wise, its proximity to cultural hubs and serene gardens creates an ideal backdrop for relaxation. The hotel’s meticulous attention to cleanliness, from clean bathrooms to floor-level hygiene, ensures a pristine environment. Staff members exhibit professional grace, delivering efficient service and thoughtful personalized touches. Overall, the experience is a harmonious merge of sophistication and comfort, making it a standout stay.",1,exaone-deep:2.4b
fake,conrad,Hotel,"The Conrad hotel in [City] offers an excellent location centrally situated near popular attractions, making it ideal for both leisure and business travelers. Rooms are meticulously clean, with well-maintained bathrooms and high-quality amenities, ensuring a polished stay. The staff is attentive and professional, with the concierge team providing exceptional local insights. Overall, Conrad delivers a seamless experience that balances convenience, cleanliness, and customer service.",1,exaone-deep:2.4b
fake,conrad,Hotel,"The Conrad Parisian Eiffel Tower Hotel boasts an optimal location near iconic attractions and efficient public transit, while rooms exude pristine cleanliness with modern amenities like marble elevators and fresh decor. Staff members exhibit professional warmth, from friendly check-ins to seamless service during requests. The seamless fusion of luxury and hospitality creates an unforgettable stay, solidifying Conrad as a top destination for both business and leisure travelers.",1,exaone-deep:2.4b
fake,conrad,Hotel,"The Conrad hotel’s location is effortlessly integrated with the city’s vibrant skyline, offering easy access to cultural hubs and modern amenities. Rooms areExceptional cleanliness ensures pristine bathrooms and polished finishes, while staff exude professionalism through courteous service. The stay was a masterclass in hospitality, blending luxury with warmth, leaving me eager to repeat the experience. (3 sentences, covering location, cleanliness, staff, and overall experience.)",1,exaone-deep:2.4b
fake,conrad,Hotel,"The Conrad hotel's convenient location near key attractions and ample parking made the stay straightforward. Rooms were spot-on with pristine linens and modern amenities like free Wi-Fi and a rooftop bar. The staff was efficiently attentive, offering thoughtful service without being overbearing. The seamless blend of comfort and convenience ensured an unforgettable stay.",1,exaone-deep:2.4b
fake,conrad,Hotel,"Noted the Conrad Hotel’s location is conveniently situated near key attractions, with easy access to public transit and nearby cultural spots, though occasional traffic around the entrance could be a minor inconvenience. The rooms exude a modern elegance—spotless interiors, premium linens, and sleek design—while restrooms and elevators ensure seamless hygiene without compromising comfort. Staff greeted warmly during check-in, offering thoughtful recommendations for local experiences, blending attentiveness with an air of warmth. The balance of polished amenities and relaxed ambiance made the stay both sophisticated and stress-free, leaving me eager to return for another night here.",1,exaone-deep:2.4b
fake,conrad,Hotel,"The Conrad hotel in [City] offers an elegant yet approachable stay. Nestled near bustling downtown attractions, its location makes commuting seamless—just a short walk to transit hubs or iconic landmarks. Rooms exude a modern elegance with high-quality amenities, and the meticulous cleanliness of the hotel ensures a spotless stay, from towels to public areas. The staff is attentive yet unobtrusive, offering professional service without being overbearing. Every detail, from breakfast options to evening evening evening, shines, making this a memorable yet effortless destination for travelers seeking both comfort and convenience.",1,exaone-deep:2.4b
fake,conrad,Hotel,"The Conrad hotel offers an exquisite blend of elegant design and modern comfort, nestled in a prime location near key attractions yet within easy reach of downtown business hubs. Rooms exhibit meticulous cleanliness, from polished surfaces to fresh linens, while staff exude hospitality without any hiccups. This seamless fusion of luxury and practicality makes it a standout stay, ensuring a memorable experience for all visitor types.",1,exaone-deep:2.4b
fake,conrad,Hotel,"The Conrad hotel’s prime location in the city center ensured a seamless stay, while rooms were immaculate and polished, offering a perfect blend of comfort and modern elegance. Staff provided attentive service throughout, from check-in to departure, enhancing the evening’s relaxation. The entire experience was unforgettable, blending strategic positioning, meticulous hygiene, and professional hospitality seamlessly.",1,exaone-deep:2.4b
fake,conrad,Hotel,"The Conrad hotel in Berlin offered an outstanding stay with a pristine environment and elegant interiors. Its prime location near major attractions and modern design created an immersive experience, while staff provided attentive and professional service throughout. The clean, comfortable spaces ensured a polished visit, making this a memorable hotel stay.",1,exaone-deep:2.4b
fake,conrad,Hotel,"The Conrad Hotel in City X offers an seamless blend of luxury and convenience. Nestled near landmarks like the city’s financial hub and popular attractions, the location provides easy access to business districts and leisure spots while maintaining a serene vibe. Rooms were spotless, with clean beds and modern amenities, and staff were attentive—check-ins were swift, and concierge services exceeded expectations. The breakfast area was vibrant, and the cleanliness extended beyond rooms to the rest of the hotel. The entire experience was memorable, blending upscale comfort with practical ease.",1,exaone-deep:2.4b
fake,conrad,Hotel,"The Conrad hotel in Berlin offers an exceptional location nestled near iconic attractions like the Museum of Modern and Contemporary Art and the Brandenburg Gate, ensuring easy access to cultural highlights while maintaining proximity to central business district hubs. Rooms maintain a pristine cleanliness, with meticulous attention to detail in decor and hygiene protocols, from polished surfaces to fresh linens. The staff exhibits exceptional professionalism, providing responsive service from check-ins to concierge-like recommendations, fostering a welcoming atmosphere. Overall, the hotel’s seamless blend of luxury and practicality created an unforgettable stay that stood out for its thoughtful balance of refinement and convenience.",1,exaone-deep:2.4b
fake,conrad,Hotel,"The Conrad hotel’s prime location near the city center and beach offered stunning views, while rooms were immaculate and well-maintained. The staff was attentive but occasionally overly formal, though service in the restaurants was exceptional. The hotel’s luxurious amenities and sleek design created an unforgettable experience.",1,exaone-deep:2.4b
fake,conrad,Hotel,"The Conrad hotel offers an seamlessly integrated location near bustling city centers and vibrant attractions, with easy access to public transport and iconic landmarks. Rooms maintain a pristine cleanliness, from fresh linens to well-maintained bathrooms, while the staff exhibits exceptional attentiveness, providing detailed knowledge of local amenities and prompt resolution of minor issues. The overall experience is a harmonious blend of modern luxury and hospitality, leaving me eager for another stay.",1,exaone-deep:2.4b
fake,conrad,Hotel,"The Conrad hotel in city X offers an exceptional location near major attractions and shopping districts, making it ideal for both leisure and business travelers. Rooms are thoughtfully clean, with well- organized closets and minimal dust, while public spaces like the lobby and elevator show attention to meticulous upkeep. The staff exudes warmth and professionalism, with staff members readily available for inquiries or requests. The experience combines sleek architecture with guest comfort, resulting in a memorable stay that balances convenience and refinement.",1,exaone-deep:2.4b
fake,conrad,Hotel,"The Conrad hotel in Berlin was an exceptional experience—its central location made commuting effortless, rooms were spotless, staff were attentive, and the overall ambiance was effortlessly balanced. The breakfast bar offerings and evening evening entertainment selections added extra charm, while staff ensured every detail felt thoughtfully attended to. A standout aspect was the quiet, modern spa facilities paired with a warm, inviting dining zone. This hotel consistently delivered on comfort and service without compromising on cleanliness or personalized touch.",1,exaone-deep:2.4b
fake,conrad,Hotel,"The Conrad hotel offers an elegant blend of modern luxury and timeless elegance, with a location that seamlessly bridges urban convenience and scenic beauty. Rooms are spot-on in cleanliness and well-equipped, with thoughtful design that balances refinement and practicality. Staff exude warmth and expertise, ensuring every detail from check-in to departure is efficiently and thoughtfully handled. The entire experience feels curated for both leisurely indulgence and busy travelers, leaving a lasting impression of quality and care.",1,exaone-deep:2.4b
fake,conrad,Hotel,"Conduct-a's Conrad hotel provides an Exceptional location nestled near iconic landmarks, with easy access to key attractions. Rooms exhibit meticulous cleanliness, from linens to surfaces, while staff demonstrate warm and professional service throughout. The experience balances opulence with comfort, making it a standout stay.",1,exaone-deep:2.4b
fake,hyatt,Hotel,"The Hyatt hotel offered an exceptionally seamless stay in a bustling city center. The location was ideal, proximity to main attractions and business hubs ensured easy navigation, while the room was spotless with a modern design. Staff provided prompt, professional service—though occasional noise in nearby rooms slightly disrupted relaxation. Overall, it delivered a polished experience that balanced luxury with practicality, leaving me eager for another visit.",1,exaone-deep:2.4b
fake,hyatt,Hotel,"The Hyatt's strategically located neighborhood and immaculate rooms made this stay flawless, while the staff’s polished demeanor and thoughtful service elevated the experience. From clean, modern suites to attentive staff who went above and beyond, this hotel delivered a seamless blend of comfort and convenience, leaving me eager for another stay at the same place.",1,exaone-deep:2.4b
fake,hyatt,Hotel,"The Hyatt Plaza in Manhattan offers a seamless blend of luxury and modern convenience, with a sleek design that balances sophistication with practicality. From my stay, the room’s meticulous cleanliness left me feeling both comfortable and meticulously maintained—a standout among many hotel environments. Our front-desk staff was attentive without overstepping, ensuring seamless navigation while maintaining professionalism. The experience at Hyatt was a masterclass in seamless harmony, blending top-tier service with an unwavering commitment to excellence.",1,exaone-deep:2.4b
fake,hyatt,Hotel,"The Hyatt hotel’s location near iconic landmarks like the park and business hubs made our stay seamless, though occasional noise from nearby traffic kept us awake at night. Rooms were spotless, but the common areas needed a bit more upkeep to match the high standards. The staff was exceptionally friendly and attentive, from check-in to tail end of the stay. While the experience was exceptional, I’d aim to improve room accessibility during peak hours. Overall, a top-notch hotel with a few minor refinements needed.",1,exaone-deep:2.4b
fake,hyatt,Hotel,"The Hyatt Hotel in Berlin offers an exceptional location near key attractions and efficient public transit, making it ideal for both leisure and business trips. Rooms maintain a clean and modern aesthetic with well-organized bathrooms, though occasional dust spots in shared areas require attention. Staff members are attentive and professional, ensuring seamless check-in/out and helpful service throughout the stay. The experience balances convenience with a polished touch, resulting in a memorable stay.",1,exaone-deep:2.4b
fake,hyatt,Hotel,"Hyatt Group’s strategic placement in city centers ensures seamless access to cultural attractions and business networks, while their meticulously clean rooms and polished spaces deliver a touch of modern elegance paired with classic comfort. The staff exudes professionalism and warmth, with attention to detail evident in every interaction, from check-ins to personalized service requests. Overall, this hotel epitomizes a harmonious blend of sophistication and functionality, offering an unforgettable stays that balance convenience with sophisticated refinement.",1,exaone-deep:2.4b
fake,hyatt,Hotel,"Location: Situated in a bustling urban center with easy access to key attractions and efficient transportation hubs, the Hyatt offers both convenience and a sophisticated touch. Cleanliness: Rooms maintain an pristine standard, with meticulously organized bathrooms and high-end amenities like padded beds and premium elevators, ensuring a spotless stay. Staff: Professional and courteous staff excel in service efficiency, from personalized check-ins to prompt problem-solving during unexpected issues. Overall Experience: The fusion of luxury and modernity creates an unforgettable stay, though occasional minor delays in shuttle services could be noted. Hyatt’s seamless blend of design and hospitality solidifies it as a top destination for both leisure and business travelers.",1,exaone-deep:2.4b
fake,hyatt,Hotel,"The Hyatt Hotel’s strategic urban positioning near key attractions and business hubs offers convenience without compromising luxury. Rooms are meticulously clean, with polished surfaces and top-tier amenities, though some areas require occasional attention. Staff members exude professionalism and warmth, though occasional logistical delays underload the seamless operation. Overall, it delivers an unparalleled blend of sophistication and practicality, making it an ideal choice for both leisure and professional travelers seeking a flawless stay.",1,exaone-deep:2.4b
fake,hyatt,Hotel,"Hyatt’s location near major attractions and business hubs made the stay seamless, while its pristine rooms ensured a clean stay. Staff provided exceptional service, from check-ins to concierge assistance, adding warmth to the experience. The blend of luxury and convenience created a memorable stay that exceeded expectations.",1,exaone-deep:2.4b
fake,hyatt,Hotel,"The Hyatt hotel’s prime location in a bustling city center provided easy access to key attractions and business hubs, while the clean, well-maintained rooms ensured a fresh yet comfortable stay. The staff displayed exceptional hospitality, from efficient check-in to thoughtful service throughout the stay, creating a seamless experience. Overall, the Hyatt offered a polished blend of luxury and functionality, making it an outstanding choice for both relaxation and productivity.",1,exaone-deep:2.4b
fake,hyatt,Hotel,"The Hyatt Group’s location is seamlessly integrated with city life, offering a blend of elegance and accessibility. Rooms maintain pristine cleanliness with thoughtful linens and polished surfaces, while staff exude professionalism and warmth. The seamless blend of advanced amenities and attentive service created an unforgettable stay that left me eager for another Hyatt experience.",1,exaone-deep:2.4b
fake,hyatt,Hotel,"Hyatt Dubai's strategic location near Dubai's business districts ensures convenient access to key attractions. Rooms exude pristine cleanliness with polished designs and modern amenities, while staff members offer professional yet warm service. The seamless blend of luxury and practicality creates an unforgettable stay for both leisure and business travelers.",1,exaone-deep:2.4b
fake,hyatt,Hotel,"The Hyatt hotel's sophisticated design and prime location provided an opulent yet refined stay, though occasional noise in nearby rooms slightly disrupted the peace. Rooms were clean and well-maintained, with thoughtful amenities ensuring ease of navigation. Staff exemplified professionalism and warmth, guiding guests through their stay with enthusiasm. The blend of luxury and practicality made the experience both memorable and seamless, leaving me eager for next time.",1,exaone-deep:2.4b
fake,hyatt,Hotel,"Hyatt Park City New York offered an outstanding stay. The location seamlessly bridges urban convenience and natural beauty, with easy access to key attractions like museums and shopping districts. Rooms were spot-on—clean, well- appointed, and well-maintained, with modern amenities like Wi-Fi and floor-to-ceil design that elevated the stay. Staff were attentive without being overbearing, offering helpful yet unobtrusive assistance. The blend of sleek interiors and polished service created a seamless experience, leaving me eager to revisit this iconic destination.",1,exaone-deep:2.4b
fake,hyatt,Hotel,"Hyatt's prime location near attractions and business districts offers convenient access to key destinations, while the hotel’s clean, modern rooms provide a polished yet comfortable stay. Staff members exude professionalism, ensuring seamless service throughout the stay, resulting in an overall exceptional experience.",1,exaone-deep:2.4b
fake,hyatt,Hotel,"Hyatt's strategic location bridges the city's heartland with global appeal, while rooms exude a polished elegance and pristine cleanliness. The staff’s professionalism and attentive service create a seamless experience, from check-ins to evening evening, leaving me eager for another Hyatt adventure. (2 sentences, covering location, cleanliness, staff, and experience in concise statements.)",1,exaone-deep:2.4b
fake,hyatt,Hotel,"The Hyatt’s location near key attractions and business hubs offers an efficient commute to the city’s heart. Rooms are meticulously clean and organized, with premium amenities like high-speed Wi-Fi and modern conveniences. Staff members exhibit outstanding professionalism, from efficient check-in to thoughtful service during peak hours. The overall stay is seamless, blending luxury with practicality, leaving me wanting to return for sure.",1,exaone-deep:2.4b
fake,hyatt,Hotel,Hyatt's central location near busy streets and city attractions paired with exceptionally clean rooms and well-maintained spaces made the stay seamless. The staff's professionalism and attentiveness ensured a smooth and pleasant experience.,1,exaone-deep:2.4b
fake,hyatt,Hotel,"The Hyatt hotel offers an unparalleled blend of luxury and convenience. Located near key attractions and offering seamless connectivity to city centers, the venue’s elegant design and strategic positioning make it ideal for both relaxation and productivity. Rooms are meticulously clean, with thoughtful attention to detail like personalized touches and ample space. The staff exudes professionalism, from check-in to departure, ensuring a smooth and satisfying stay. Overall, it’s a destination that balances sophistication with practicality, leaving me eager to revisit the experiences this evening.",1,exaone-deep:2.4b
fake,hyatt,Hotel,"The Hyatt Dubai’s location is seamlessly integrated with the city’s business hub, offering easy access to airports, shopping districts, and cultural attractions. Rooms are meticulously clean with polished interiors and modern amenities, ensuring a polished yet relaxed stay. The staff exhibits exceptional professionalism, with staff members going above and beyond to assist, from check-ins to personalized service requests. The overall experience is a harmonious blend of luxury and functionality, making Hyatt a standout choice for both leisure travelers and professionals seeking a seamless stay.",1,exaone-deep:2.4b
fake,omni,Hotel,"Omni delivered an exceptional stay with its centrally located spot near key attractions and sleek interiors. The rooms were spotless, and the staff’s genuine warmth and proactive assistance elevated the experience. With thoughtful service and ergonomic amenities, the hotel truly delivered an exceptional stay.",1,exaone-deep:2.4b
fake,omni,Hotel,"Omni delivered an exceptional stay with a well-placed location near iconic attractions like the city park and cultural centers. The hotel's rooms were meticulously clean with modern amenities, and staff provided exceptional service throughout. Though slightly overpriced, the experience thoroughly exceeded expectations.",1,exaone-deep:2.4b
fake,omni,Hotel,"The location of Omni is conveniently near key attractions and public transport hubs, while rooms offer an pristine cleanliness with well-organized amenities. Staff members displayed exceptional attentiveness and professionalism throughout, ensuring a smooth and enjoyable stay. Overall, a memorable and well-designed hotel experience that truly exceeded expectations.",1,exaone-deep:2.4b
fake,omni,Hotel,"Omni delivered an exceptional stay with a conveniently located property right near key attractions and public transit hubs. The rooms are spotless, featuring a subtle, refreshing aroma and polished fixtures, while the staff exuded warmth and professionalism throughout. The evening dining experience at the rooftop bar offered stunning city views but was slightly overpriced. Overall, this hotel combined seamless convenience with a touch of luxury, making it a standout choice for those prioritizing location and service quality.",1,exaone-deep:2.4b
fake,omni,Hotel,"The Omni Plaza Hotel's location near downtown attractions made it easy to explore while the clean rooms and friendly staff provided an authentic stay. Everything from the check-out desk to the breakfast area was well-maintained, and the staff's attentive service enhanced the visit without overdoing it.",1,exaone-deep:2.4b
fake,omni,Hotel,"Omni hotel offers an excellent location in the city center, close to major attractions and efficient public transport. The rooms are well-maintained with clean linens and modern amenities, though some areas like the elevator in the same building feel a bit crowded. The staff is friendly and attentive, with staff members going above and beyond with checked-in and checked-out requests. Overall, it's a solid stay but could use minor updates on noise levels and room amenities.",1,exaone-deep:2.4b
fake,omni,Hotel,"The Omni hotel strike a balance between modern comfort and classic charm, with a location nestled near the city’s heart but slightly off-center from major attractions. Rooms offered a pristine cleanliness, though some areas needed a quick wipe-down. The staff was professional yet warm, efficiently handling requests without any hiccups. The overall experience was solid—ideal for couples seeking a blend of style and reliability.",1,exaone-deep:2.4b
fake,omni,Hotel,"Omni's strategic location near iconic landmarks like museums and shopping districts made our visit straightforward, yet its pristine rooms and efficiently handled cleanliness ensured a spot-on stay. The staff’s attentiveness and friendly demeanor turned every interaction into a pleasant experience, leaving me eager to return for future trips.",1,exaone-deep:2.4b
fake,omni,Hotel,"The 'Omni' hotel’s strategic location near major attractions and efficient public transit made day trips seamless. Rooms were immaculate, with a sleek design and quick cleaning—ideal for both relaxation and quick trips. The staff exuded professionalism, handling check-ins, requests, and service with polished attentiveness. This blend of convenience, cleanliness, and expert service made the stay unforgettable.",1,exaone-deep:2.4b
fake,omni,Hotel,"The 'Omni' hotel struck a great balance between convenience and comfort. Location-wise, its proximity to local attractions and efficient public transport made navigating easy, though the nearby street had some noise. Rooms were spot-on—clean, well-equipped, and nicely appointed—though some areas needed minor upkeep. The staff was friendly and attentive, from check-in to dinner reservations, though service speed varied. Overall, it was a solid stay with a touch of charm, though minor details could elevate it further.",1,exaone-deep:2.4b
